<?xml version="1.0" encoding="UTF-8"?>
<!DOCTYPE orders SYSTEM "orders.dtd">
<orders>
  <order order_id="209">
    <customer_fname>Φρειδερίκος</customer_fname>
    <customer_lname>Σαλπιγγίδης</customer_lname>
    <total_cost>139.26</total_cost>
  </order>
  <order order_id="213">
    <customer_fname>Απόστολος</customer_fname>
    <customer_lname>Χριστοδουλόπουλος</customer_lname>
    <total_cost>85.50</total_cost>
  </order>
  <order order_id="205">
    <customer_fname>Γιάννης</customer_fname>
    <customer_lname>Βαβούρας</customer_lname>
    <total_cost>81.20</total_cost>
  </order>
  <order order_id="195">
    <customer_fname>Αλέξανδρος</customer_fname>
    <customer_lname>Βουκεφάλας</customer_lname>
    <total_cost>58.60</total_cost>
  </order>
  <order order_id="202">
    <customer_fname>Πηνελόπη</customer_fname>
    <customer_lname>Βασιλειάδου</customer_lname>
    <total_cost>58.60</total_cost>
  </order>
  <order order_id="199">
    <customer_fname>Ελένη</customer_fname>
    <customer_lname>Ωραιοπούλου</customer_lname>
    <total_cost>37.00</total_cost>
  </order>
  <popular_product product_id="5">
    <product_name>Van Cat Classic</product_name>
  </popular_product>
  <popular_product product_id="2">
    <product_name>Eminem Platinum Adult</product_name>
  </popular_product>
  <popular_product product_id="6">
    <product_name>Body Suplement 60 caps</product_name>
  </popular_product>
  <popular_product product_id="19">
    <product_name>Belcado Fresh Meat Beef</product_name>
  </popular_product>
  <popular_product product_id="15">
    <product_name>Αυτόματη Ποτίστρα Νερού</product_name>
  </popular_product>
</orders>
